{
  "schema_version": 1,
  "zoom_level": "L3",
  "programme_id": "001-commodity-natural-gas",
  "research_line_id": "008-next-defensible-edge",
  "experiment_id": "001-front-curve-feasibility-271",
  "governance_generation": "legacy_pre_15_step",
  "historical_status": "held",
  "summary": "Initial front-curve feasibility slice.",
  "outcome": "front_curve_feasibility_hold_before_preregistration",
  "issue_lineage": [
    271
  ],
  "source_artifacts": [
    {
      "path": "research/exploratory/front-curve-feasibility-271.json",
      "commit": "3e267e9d7df53c3ce927b1007b6e694f3920bde5",
      "sha256": "59cd7b5e40b5ddcfc5ed0f37478bdc47d3665ecf4e724f1d4300940ae6363bc3",
      "preserved_as": "exploratory-result.json",
      "note": null
    }
  ],
  "decisions": [
    {
      "id": "legacy-001-front-curve-feasibility-271-disposition",
      "decision": "Preserve historical disposition: front_curve_feasibility_hold_before_preregistration.",
      "status": "active",
      "superseded_by": null
    }
  ],
  "recommendations": [],
  "open_questions": [],
  "metrics_ledger_refs": []
}
